WNP9QWD2XJYT,829f9a28-2bb3-4a4e-a87c-8dcaf6cac245,a17227e0-5f0e-40cf-be4f-cda2fe67aa13,RECURRING XX4163 WWWDINNERLYCOM HTTPSDINNER NY,40.66,Debit,Weekly meal service kit delivery.,Food & Drink / Food delivery
PAEJPZXXTQ2M,e317b51e-d8a4-4a93-8472-b70f7e6ef8c1,0386d864-fdf1-4cb5-9eb8-0c4129af4954,POS Withdrawal - UBER EATS 1455 MARKET ST 8005928996 CAUS - Card Ending In 8349,33.93,Debit,I ordered food off of UberEats. I believe it was a restaurant.,Food & Drink / Food delivery
PC663CTNCDXX,bff52c42-bc89-4614-ab11-11c7ee8fbd06,141b0c54-a34f-44da-b184-6e0852183934,POS Withdrawal - DOORDASH*CHIPOTLE 303 2nd StreetSuite 800SAN FRANCISCOCAUS - Card Ending In 8349,18.89,Debit,Hadn't had Chipotle in a while so I wanted to have some delivered by DoorDash.,Food & Drink / Food delivery
YYCA2DXN94NG,6cb86f98-dee0-43af-af2f-bcf034056234,7c5c7282-da28-49d7-b4a9-dacd126499b9,POS Withdrawal - PIZZA HUT #014349 13003 SE KENT KANGLEY R2536395560 WAUS - Card Ending In 8349,38.02,Debit,"Got some Pizza Hut, as my brother wanted it.",Food & Drink / Food delivery
MFVVAY4H7Y4H,26065e9f-c7d3-4f34-abcc-1fc670a75dce,bd4d37c8-a0cc-497b-bd74-edbfdcb20452,POS Withdrawal - DOORDASH*QDOBA MEXICAN 303 2nd StreetSuite 800SAN FRANCISCOC - Card Ending In 8349,26.54,Debit,"I ordered some Qdoba, which is a restaurant chain.",Food & Drink / Food delivery
J6TM2D4MANTG,a3816c27-d191-4b2c-a780-25438df698f9,027e5c7c-ecc5-460d-958c-912e6fc5eb03,POS Withdrawal - PIZZA HUT #014349 13003 SE KENT KANGLEY R2536395560 WAUS - Card Ending In 8349,33.01,Debit,Got some Pizza Hut for my brother and I.,Food & Drink / Food delivery
J6TM2D4MANTG,5db3b966-ea74-4b16-aff7-ef171e46ea46,a51cc101-8a08-4ad4-8876-145016cd83a9,XXXXX8046 DD DOORDASH TACOBELL XXXXX1040,16.68,Debit,Ordered food from DoorDash.,Food & Drink / Food delivery
4TGHEHM2RVX7,51f69b25-563b-4d45-900e-a6eb3750b10f,1af6fd00-e69f-413e-9aa1-13d176ef478e,SEAMLSSTSWIRLCREPE 5/11 PURCHASE SEAMLESS.COM NY,43.93,Debit,Ordered dinner from T-Swirl Crepe restaurant through Seamless delivery service.,Food & Drink / Food delivery
J6TM2D4MANTG,f88e8327-5bbe-4e2e-9549-0ad36334ae36,aea48a35-9a33-47f0-8667-37e6a24e86f2,POS Withdrawal - DOORDASH*DAIRY QUEEN 303 2nd StreetSuite 800SAN FRANCISCOCAU - Card Ending In 8349,29.9,Debit,I got some Dairy Queen using DoorDash.,Food & Drink / Food delivery
J6TM2D4MANTG,e6e5df69-e930-4724-a897-68234d77b1f1,945b437b-8c06-496e-bd4a-f376af5d809d,POS Withdrawal - UBER EATS 1455 MARKET ST 8005928996 CAUS - Card Ending In 8349,27.49,Debit,I had McDonald's delivered.,Food & Drink / Food delivery
J6TM2D4MANTG,fea4984f-c554-4122-9995-cfb89211e416,98e12d34-e84e-49e9-b103-cc91efab504c,POS Withdrawal - DOORDASH*QDOBA MEXICAN 303 2nd StreetSuite 800SAN FRANCISCOC - Card Ending In 8349,27.59,Debit,I got some Qdoba since I hadn't had it in a while and was craving it.,Food & Drink / Food delivery
4TGHEHM2RVX7,5346ec4a-8536-40cd-97e9-6805cfa671e1,31f7dad6-15e3-477c-857e-88b11a8f8053,POS Withdrawal - DOORDASH*CHIPOTLE 303 2nd StreetSuite 800SAN FRANCISCOCAUS - Card Ending In 8349,18.71,Debit,I ordered some Chipotle using DoorDash.,Food & Drink / Food delivery
4TGHEHM2RVX7,0a6ab7c3-2e84-43e3-b3db-352535163b7a,d3a0c46f-dd12-46bd-a568-40923cb48f59,PAYPAL *DOMINO' 4029357733 /MA - PURCHASE,30.53,Debit,An order from Domino's Pizza.,Food & Drink / Food delivery
4TGHEHM2RVX7,ad52a211-f9b5-41a8-aa8b-9d5abe3b7cd6,39050dd7-0a8b-4778-a28e-0e3d39adbf09,POS Withdrawal - DOORDASH*QDOBA MEXICAN 303 2nd StreetSuite 800SAN FRANCISCOC - Card Ending In 8349,26.54,Debit,I got some Mexican food via DoorDash.,Food & Drink / Food delivery
G7YACCWXTNEG,8a0aee56-08ec-4a09-9232-de563fafdccd,fd0efda1-3de8-4709-b172-5f497ba00f68,DD DOORDASH CHICK-FIL Debit Card,25.32,Debit,I ordered Chick-Fil A through DoorDash.,Food & Drink / Food delivery
G7YACCWXTNEG,835b12fd-293f-4167-a63f-13b93cd7e423,db9e69cc-b672-4985-a7f7-4e9f8688ed32,POS Withdrawal - DOORDASH*BURGER KING 303 2nd StreetSuite 800SAN FRANCISCOCAU - Card Ending In 8349,21.91,Debit,I got some Burger King using DoorDash.,Food & Drink / Food delivery
G7YACCWXTNEG,c3d69954-87a1-4698-bf24-e06a720c8cca,ef9dac3e-c1f2-4c75-b8b8-5e0d03b6dd8d,POS SIG 06/06 VISA #3509 DD DOORDASH TOBYSORIG 855-973-1040 CA,15.96,Debit,Restaurant delivery.,Food & Drink / Food delivery
G7YACCWXTNEG,287b568f-9c6e-4bc4-a8a8-dedebadca3cb,19991470-9b7b-4abb-87c6-a2856905efdb,POS Withdrawal - DOORDASH*DAIRY QUEEN 303 2nd StreetSuite 800SAN FRANCISCOCAU - Card Ending In 8349,33.03,Debit,"I got some Dairy Queen, which is a restaurant.",Food & Drink / Food delivery
G7YACCWXTNEG,086ae0a8-b52a-4923-b57d-adb10b93167f,ee49f10b-bebb-43d9-b627-218644b51a3d,POS Withdrawal - DOORDASH*MCDONALDS 303 2nd StreetSuite 800SAN FRANCISCOCAUS - Card Ending In 8349,33.95,Debit,I ordered some food from McDonald's.,Food & Drink / Food delivery
G7YACCWXTNEG,223f63bd-9400-47e7-85c2-423d1162f8fa,37d210a0-1821-4940-ad8b-a04d8dd26aa3,POS Withdrawal - DOORDASH*DENNYS 303 2nd StreetSuite 800SAN FRANCISCOCAUS - Card Ending In 8349,23.6,Debit,I ordered Denny's (a restaurant) off of DoorDash.,Food & Drink / Food delivery
G7YACCWXTNEG,9944bd01-131d-40e3-bfae-ea84b142ea7d,fbfc1dc6-ea3e-41d9-85c3-43fa07e773ae,Burger King - HIA SN1048 DOHA,23.27,Debit,Food at Burger King.,Food & Drink / Fast food
G7YACCWXTNEG,f23c648e-69ee-4e91-a740-157ca1c3c337,735ae153-e5b4-456c-814e-ccac3a16bb7f,Wendy's #109 Ontario Ca,5.39,Debit,Food at Wendy's.,Food & Drink / Fast food
G7YACCWXTNEG,5fddc984-726d-4ce6-bf70-6ba9b21fc568,d7d75528-4ff5-46d2-9f5d-3e1c62832d5b,WENDY'S #7866,4.69,Debit,I got ice cream from Wendy's.,Food & Drink / Fast food
G7YACCWXTNEG,c4786f0f-e489-4192-99b3-4650cb682e43,012a6f8f-74ff-4e14-9a86-c018114915f4,POS Withdrawal - DOORDASH*TACO BELL 303 2nd StreetSuite 800SAN FRANCISCOCAUS - Card Ending In 8349,23.5,Debit,I got some Taco Bell from DoorDash.,Food & Drink / Fast food
G7YACCWXTNEG,8e292eac-e390-4ab5-8111-6ab07fc4aa4f,df93f10f-6467-4c02-b15b-77809b4a9647,MCDONALDS - YORK 207 YORK,1.29,Debit,A coffee from McDonald's.,Food & Drink / Fast food
6XA9X4RD9RAY,0f41dff0-eed8-4348-9bd6-4825c54d4e61,6f26af73-3def-41eb-8c7d-f6e74b694fcf,POS Withdrawal - DOORDASH*MCDONALDS 303 2nd StreetSuite 800SAN FRANCISCOCAUS - Card Ending In 8349,25.76,Debit,I got McDonald's again. I get food from there quite a bit when I can.,Food & Drink / Fast food
WNP9QWD2XJYT,68cc41b2-f0b2-46e5-8222-5f8a3f2a32d7,371fec41-09bc-436d-9041-8eb26bc35ecf,MCDONALD’S F13118,6.87,Debit,I bought breakfast at a nearby McDonald’s.,Food & Drink / Fast food
PAEJPZXXTQ2M,1d8e3a0a-7dca-4f34-8c0d-e1ac2d8883cd,06f85f17-a229-4bd3-ab05-aad3e65a6bef,POS Withdrawal - Subway 41234 12722 SE 312th Auburn WAUS - Card Ending In 8349,18.2,Debit,I got some Subway sandwiches.,Food & Drink / Fast food
PC663CTNCDXX,13bb1b2f-69d2-411e-8bfb-d4bbd8826ff4,b6aa895f-77dc-4cfb-a216-05d8f32542d0,Signature POS Debit 06/09 6337 KY 185-9278590 McDonald's,12.53,Debit,I had McDonald's for lunch.,Food & Drink / Fast food
YYCA2DXN94NG,7872904d-02ae-45ca-bd3a-c764e98502ec,9a71e588-8849-4d4a-9741-14f177a876dd,3CPAYMENT*STARBUCKS 286 YORK,7.15,Debit,Coffees from Starbucks.,Food & Drink / Coffee and tea
MFVVAY4H7Y4H,943f8e30-2f0a-4fb2-905b-7e459b6c8a7c,9a680e20-e01d-4295-9e69-697b13cdfd21,STARBUCKS 800-782-7282 800-782-7282 WA,25,Debit,This is reloading my Starbucks funds on the mobile app.,Food & Drink / Coffee and tea
MQGN7N3PKYRA,5bf32298-3654-4ca3-bed6-eabe8dacba57,c8b7d41b-1504-4aad-be72-223c4c32fe43,8382 Debit Card Purchase Starbucks Store 00751,4.76,Debit,Purchased a drink from Starbucks.,Food & Drink / Coffee and tea
J6TM2D4MANTG,6c22b8b7-7e75-4f24-8a05-f201afc9816e,b8b3085b-a7c1-4634-9950-d46f33d85118,3CPAYMENT*STARBUCKS 286 YORK,11.5,Debit,Coffee and muffins at Starbucks.,Food & Drink / Coffee and tea
4TGHEHM2RVX7,6ec6ffb8-5ff7-4685-9901-43051684c9cc,2dc31a7a-d755-4d5f-b9d9-2888e8c93916,SQ *MUDLEAF COFFEE Plano TX,14.32,Debit,This is for coffee drinks.,Food & Drink / Coffee and tea
PC663CTNCDXX,9a944445-272b-4e6d-8ed0-fbb5f1962423,2622b218-455a-430b-95e9-b631aacb9f12,DUNKIN #343461 PLYMOUTH /MA US CARD PURCHASE,3.41,Debit,Iced coffee at Dunkin Donuts.,Food & Drink / Coffee and tea
PC663CTNCDXX,6d28c4b8-1caa-4f23-a2f5-dffe42cff066,790d9c9d-c8ab-43fe-8c89-a3ba9fa235b0,8382 Debit Card Purchase Kfteausa_247,24.37,Debit,Purchased tea from Kung Fu Tea.,Food & Drink / Coffee and tea
PC663CTNCDXX,ae1b6ddf-7de6-4d0d-a9f2-5f8e93b6e100,f3b22c17-2cb1-4c12-9c23-bdc5b00393cf,HTEAO - PLANO,5.81,Debit,This is for the purchase of iced tea.,Food & Drink / Coffee and tea
PC663CTNCDXX,0774788f-050f-4a09-a246-71b7d62d711a,9ae95294-a2f8-4e59-9c5e-1e6e17acedad,POS Withdrawal - DOORDASH*BIGFOOT JAVA 303 2nd StreetSuite 800SAN FRANCISCOCA - Card Ending In 8349,17.19,Debit,I got some coffee from a coffee shop.,Food & Drink / Coffee and tea
G7YACCWXTNEG,f9008ada-9916-4b73-8208-90c7b219a1f0,3c952d9c-55a9-4dbf-b48d-464bcd84f5fa,POS Withdrawal - DOORDASH*BIGFOOT JAVA 303 2nd StreetSuite 800SAN FRANCISCOCA - Card Ending In 8349,17.19,Debit,I wanted some coffee in the morning. This is a coffee stand.,Food & Drink / Coffee and tea
G7YACCWXTNEG,8924f82b-c46e-4194-8d33-56b7b9ff5303,4b4a5aa9-ecbf-4775-8a53-0c648cfb4a22,FENG CHA TEAHOUSE RICHARDSON TX,5.57,Debit,This was for a boba tea.,Food & Drink / Coffee and tea
G7YACCWXTNEG,c50684bd-a6d9-4f03-86f4-c6d9d0acfd99,59a2b34e-1a0a-4f62-a150-de03f03a384b,DAILY GRINDS,15.23,Debit,This is for the purchase of two coffees and a croissant.,Food & Drink / Coffee and tea
6XA9X4RD9RAY,02d9b268-e5f5-4bd0-8a36-1faba5719e88,effde341-03fd-4844-aaf0-b100aeeb0d2e,DEBIT CARD PURCHASE XXXXX4094 BRUSTERS ICE CREAM NEWARK DE,16.4,Debit,I purchased ice cream at ice cream shop.,"Food & Drink / Bakeries, ice cream shops and dessert shops"
WNP9QWD2XJYT,17b6f6df-1156-4eb4-88bd-58f06fd6e183,838b844a-666d-41ed-b534-8e13514bbd12,TST* Batch Cookies,23.5,Debit,This is a dessert place!.,"Food & Drink / Bakeries, ice cream shops and dessert shops"
PAEJPZXXTQ2M,bb50a1f0-7587-4810-80ad-8dd95de6e9f8,2ad8fb85-346e-44c6-b364-779e7f5872a5,Sugar Pine Creamery,6.47,Debit,This is for ice cream.,"Food & Drink / Bakeries, ice cream shops and dessert shops"
PC663CTNCDXX,83f8bce3-1b9f-4305-ab15-9aaea9338bc3,7974f2e1-feed-4754-8051-3ffcc22f84ec,BB* CENTER BAR,10.63,Debit,This is a bar.,Food & Drink / Alcohol & Bars
YYCA2DXN94NG,5d2b0ff1-bcbb-4db3-a1bf-e6438232966d,d5418872-0e04-4a8c-bb8b-45658daaf421,COSY CLUB YORK YORK,21.2,Debit,This was for a round of drinks in a bar.,Food & Drink / Alcohol & Bars
MFVVAY4H7Y4H,17b2f7ed-21e0-49b5-97f6-6ed44d917578,52d4b188-5b04-41a5-863b-bc4e23447ad3,ALLEGNT BUYONBOARD,15,Debit,This was an alcohol purchase on an Allegiant Airlines flight.,Food & Drink / Alcohol & Bars
G7YACCWXTNEG,7f06329a-d13b-4713-b0ab-542b14ceac66,2b6f2ca1-e264-4c05-af8b-9af69e565744,Walgreens Store 33 ATM/POS,4.32,Debit,I bought a drink an alcoholic drink at the Walgreens in Vegas.,Food & Drink / Alcohol & Bars
G7YACCWXTNEG,26c60250-bd30-418b-a22f-eb887c0a392d,3125852e-aa8f-4901-bf31-ef63ca0b0543,Zelle Debit PAY ID:CTIdmnWskvry ORG ID:BAC NAME:WISKERIA COR,8.3,Debit,Liquor.,Food & Drink / Alcohol & Bars
G7YACCWXTNEG,39aca408-907e-4547-bf1c-822d69b7fd3b,72bd9709-a13f-4e7a-8076-fddb625ece41,Google *YoungJoy,2.99,Debit,Money spent on a video game I play.,Entertainment / Video games
6XA9X4RD9RAY,cdd79c6f-cedf-4a7a-98e7-1b81909be177,6edd9d63-0c68-4353-a952-2ab15f903fd4,POS SIG 01/30 VISA #7297 STEAMGAMES.COM 4259522 425-8899642 WA,5.59,Debit,Videogame from steam.,Entertainment / Video games
WNP9QWD2XJYT,a9f44284-2470-49a5-88a0-4d5b396cd102,fda73c2f-d639-42fb-a2d0-b61bf7203a65,PAYPAL *ARENANE San Jose /CA US CARD PURCHASE,21.25,Debit,Gem purchase in the game Guild Wars 2.,Entertainment / Video games
PAEJPZXXTQ2M,ea12588c-acc3-4545-8224-f184b51acdc6,cad1509a-236d-498a-932e-0f4996d13499,PAYPAL *EPIC GA San Jose /CA US CARD PURCHASE,12.74,Debit,Fortnite Crew pass from Epic Games.,Entertainment / Video games
PC663CTNCDXX,c3fb3cda-e03b-4b0c-8490-c9ecf54c82f1,48a8f89b-241f-4079-934f-36c22b99496e,GOOGLE *Freshplanet CARD#8046,5.3,Debit,Made an in-app purchase.,Entertainment / Video games
YYCA2DXN94NG,6506fb6b-7a4f-47e8-8fb6-92b0dfd1fa14,16f3051a-fb4b-4898-93c6-f78a203a4035,Google *YoungJoy g.co/helppay#CA,0.99,Debit,I bought something in a video game.,Entertainment / Video games
MFVVAY4H7Y4H,17ea0e27-864f-42cc-bcd7-f019e050a773,5d1c45db-624c-485f-af44-4dd980e93dfa,DEBIT CARD PURCHASE XXXXX8046 Google SuperPlay XXXXX0000 C,3.18,Debit,In-app purchase.,Entertainment / Video games
G7YACCWXTNEG,2701572e-21a8-44e7-bfd5-27154b7b1964,feab226c-4176-4a5a-a904-fb267aefec21,Google *YoungJoy,4.99,Debit,Money spent on a video game.,Entertainment / Video games
G7YACCWXTNEG,3178fdad-23dd-4f44-8deb-0eab9569abb6,abf4be45-8468-476a-8996-9b7e067a5864,PP*GOOGLE KING CARD#8046,3.18,Debit,Video game in-app purchase.,Entertainment / Video games
G7YACCWXTNEG,9b86c725-a329-43e6-9ed9-db4ac38ba20a,a9278419-467f-4517-bca7-4d8ac547354a,PAYPAL *GOOGLE San Jose /CA US CARD PURCHASE,5.3,Debit,Tokens for mobile game through Google Play.,Entertainment / Video games
6XA9X4RD9RAY,2f8ae28c-c0ce-4fae-ac89-6df5a79de424,4cefd757-4ef4-4e32-a078-0a27de7134d1,8382 Recurring Debit Card Www.Neopets.Com,24.95,Debit,Monthly membership for online gaming site.,Entertainment / Video games
WNP9QWD2XJYT,ba1547bb-a5a9-4ac4-9dbe-fe6720bdb5ba,1ec28b9f-b873-4664-b776-26844561d164,POS SIG 12/25 VISA #7297 STEAMGAMES.COM 4259522 425-8899642 WA,3.74,Debit,Microtransaction for a videogame via Stream.,Entertainment / Video games
PAEJPZXXTQ2M,7cd90371-32ce-4d1e-8098-2a1f8249ba28,14adee8b-977e-45b0-aced-09e54ade3014,Steam Games,5,Debit,This is for a purchase of a video game.,Entertainment / Video games
PC663CTNCDXX,7bdd7395-4c93-4cb6-ab61-4ca70c7732e9,cb8ae500-06b1-488b-92e3-231f37d3edd4,Recur Payment 06/01 6337 CA NETFLIX.COM NETFLIX.COM,16.79,Debit,I paid for my Netflix subscription.,Entertainment / TV and movies
YYCA2DXN94NG,3b6c96c5-edd0-463f-a949-6d803bfe23f6,04b32d02-4ea2-4194-a3a5-0b2cb9638e4c,3042 Recurring Debit Card Viacomcbs Streaming,4.99,Debit,Fees for Paramount+ streaming service.,Entertainment / TV and movies
MFVVAY4H7Y4H,f28071c1-7a23-4412-8f15-00f01d884617,0907a620-b0a6-41a8-b696-17098677682b,POS Withdrawal - Amazon Prime*JC6143A83 440 Terry Ave N Amzn.com/billW - Card Ending In 8349,6.59,Debit,This was for my Amazon Prime membership.,Entertainment / TV and movies
J6TM2D4MANTG,7a1b2238-df83-48ef-b440-5c7ea79f6ff2,d418282d-ff99-4652-8920-08d0e281bc64,Netflix.com netflix.com CA,19.99,Debit,Monthly payment for my Netflix account.,Entertainment / TV and movies
J6TM2D4MANTG,466e9925-4494-4169-a5f8-e90d3dec4c26,913daa6a-ed23-4cce-9546-975ad5327df0,RECURRING DEBIT CARD XXXXX6147 Netflix.com netflix.com CA,19.99,Debit,This is a payment for my Netflix subscription.,Entertainment / TV and movies
4TGHEHM2RVX7,dff88212-f9bb-4016-ad9a-02e53c28e90c,5a00e4f4-4ea9-4e48-bbe5-ae8e329df7cd,AMZN Digital 888-802-3080 WA 05/07,5.34,Debit,Movie Rental.,Entertainment / TV and movies
J6TM2D4MANTG,2561d29c-1909-4a95-b20a-0ff43b0eeb21,b5c206f1-3891-4972-b628-9e391a9023af,RECURRING DEBIT CARD XXXXX6150 PARAMOUNT XXXXX5343 CA,4.99,Debit,Streaming service charges.,Entertainment / TV and movies
J6TM2D4MANTG,4504afaa-e1d2-4f21-b9d0-260c699624b9,7f7fd361-9e15-4176-ad17-35e901e76df6,PEACOCK 1E845 PREMIUM,4.99,Debit,I made my monthly payment for my Peacock streaming service.,Entertainment / TV and movies
J6TM2D4MANTG,c4442fc9-b5c7-4820-b89c-8c2a3541c6c7,037e6d29-ad65-4a3b-a6f9-45086222644d,PRIME VIDEO*7L2715XA5 353-12477661,1.99,Debit,This is a charge for a film streamed via Amazon Prime Video.,Entertainment / TV and movies
4TGHEHM2RVX7,bab15b86-0336-4969-a692-815750487d7c,7192c08d-5609-42a4-a8a8-438d21ba77f9,Recur Payment 10/19 6337 CA BURBANK Disney PLUS,8.47,Debit,I paid for my Disney Plus subscription.,Entertainment / TV and movies
4TGHEHM2RVX7,af86d139-b870-4564-8f92-441e4bf70a3c,f3b85691-43aa-46c4-b1ba-6ea01ac83fc1,RECURRING DEBIT CARD XXXXX4083 Peacock E0F5D PremPlus XXXXX0138 NY,5,Debit,Peacock streaming service add on Fee (monthly premium).,Entertainment / TV and movies
4TGHEHM2RVX7,7250417f-7e6f-4357-bb92-aa1173da4b81,f1988f1b-6143-421f-9c1e-a58255bf4e29,POS Withdrawal - PAYPAL *NETFLIX.COM 7700 EASTPORT PARKWAY 4029357733 CAUS - Card Ending In 8349,19.81,Debit,This is for the Netflix streaming service.,Entertainment / TV and movies
G7YACCWXTNEG,70886279-f5b8-4e5c-9d03-9b5a282bc816,e3807921-77ef-43aa-bd68-e1d8466f3428,POS Withdrawal - PAYPAL *DISNEY PLUS 7700 EASTPORT PARKWAY 4029357733 CAUS - Card Ending In 8349,8.8,Debit,This is for my Disney Plus membership.,Entertainment / TV and movies
G7YACCWXTNEG,43e0fe4e-cb57-4d1d-914b-7037395984c2,88b6820e-b155-41fb-a793-4f859b14e7fb,HELP.HBOMAX.COM Debit Card,14.99,Debit,This is my monthly HBO Max subscription payment.,Entertainment / TV and movies
G7YACCWXTNEG,20a210c9-74d8-42eb-9a3d-9e20ecb3272a,e84fd2ea-ac06-4bf7-b62c-26c90115ca2f,POS Withdrawal - PAYPAL *DISNEY PLUS 7700 EASTPORT PARKWAY 4029357733 CAUS - Card Ending In 8349,8.8,Debit,Used PayPal to pay for Disney+.,Entertainment / TV and movies
G7YACCWXTNEG,4a58cfbd-e934-4102-a350-413a5f3862b9,2ee2337d-75d0-4623-8542-71ee625c6529,Signature POS Debit 10/22 6337 WA 888-802-3080 Prime Video,3.24,Debit,I rented a movie on Prime video.,Entertainment / TV and movies
G7YACCWXTNEG,ec7e16b6-bc58-4bdb-8a2f-528fb9faaadf,d3bdd2af-1550-4fe0-99a3-7e217cfd3cf1,POS Withdrawal - Prime Video*KI0MC0ZS3 440 Terry Ave N 888-802-3080 WA - Card Ending In 8349,5.49,Debit,I paid for a streaming service off of Prime Video that wasn't Prime Video.,Entertainment / TV and movies
G7YACCWXTNEG,ba7a0577-1a18-4fcb-bec9-0edb32a819f8,2d3e0466-9db2-4351-8328-93cff8b750bd,POS Withdrawal - HELP.HBOMAX.COM Warner Media30 Hudson YNEW YORK NYUS - Card Ending In 8349,16.5,Debit,This is for the HBO Max streaming service.,Entertainment / TV and movies
G7YACCWXTNEG,760b2945-9796-419f-a562-8ade2d29304d,2401f23a-e0f2-45f6-9068-968f51221e99,RECURRING DEBIT CARD XXXXX4119 GOOGLE *YouTube TV g.co/helppa CA,64.99,Debit,Youtube TV monthly streaming service.,Entertainment / TV and movies
G7YACCWXTNEG,3fca8f4d-0371-49d2-8270-b148dd121c02,1ced43fb-7df5-4017-bdc4-35b91ee2bd22,Netflix.com 04/03 PURCHASE XXX-XX03700 CA,16.57,Debit,Paid monthly subscription to Netflix.,Entertainment / TV and movies
G7YACCWXTNEG,3ef0a576-88b4-4da0-a10a-edd6a7e12008,d224de45-2224-4f92-86e9-12987c74ad66,Store Purchase PARAMOUNT+,11.31,Debit,Payment for streaming service.,Entertainment / TV and movies
G7YACCWXTNEG,741dbf26-69f3-4f57-aacf-3ae02b632a80,26bf58a7-74e5-41d8-9c08-c09fa621a00b,NETFLIX.COM 866-579-7172,9.99,Debit,Monthly Netflix fee.,Entertainment / TV and movies
G7YACCWXTNEG,cb4cace8-43d3-4294-80a7-fc417bd9937d,8d5a55da-f6c3-4df2-94d6-95ec30f40442,DEBIT CARD PURCHASE XXXXX8046 Amazon Digit*1O64S76G1 amzn.com/bi WA,10.61,Debit,Charged for streaming service add-ons.,Entertainment / TV and movies
6XA9X4RD9RAY,4c6eaa3b-faf5-4aaf-aea6-9e0084ed884b,5d07c7a2-f147-4912-8bbe-0fa9df0c616e,BRITISH MENSA LTD 05441560 918471,54.95,Debit,An annual membership subscription cost.,Entertainment / Other
WNP9QWD2XJYT,60c4334e-d4bb-4587-8acd-79f9f66cb343,9ae20971-b2b2-4fa1-a005-5292db05e067,DEBIT AUTHORIZATION Jun15 03:42p 1459 AT 15:42 CKO*PATREON* MEMBE 833-9728766,3,Debit,Patreon membership.,Entertainment / Other
PAEJPZXXTQ2M,e1a731aa-0715-4434-a07f-0a1085fe4629,a13d6967-43fa-4d09-a3a7-124cf000cb44,TME*TIME 855-227-9517 NY,2,Debit,This is for a magazine subscription.,Entertainment / Other
PC663CTNCDXX,40bebe27-f981-465e-a3ea-7b47a32a5e47,4ada274d-1c94-45ab-a594-bd979db25ff6,HOLLYWOOD BOWL CD 3041,19.97,Debit,Money spent at a bowling alley during a family outing.,Entertainment / Other
YYCA2DXN94NG,f864e154-e529-4103-85b6-f2b8c80596ff,4791753d-fcf9-48da-b1e6-3749b4760e85,AXS.COM*PROMOWEST PROD 06/14 PURCHASE 888-929-7849 CA,133.16,Debit,Purchase of concert tickets.,Entertainment / Music
MFVVAY4H7Y4H,59a0ab96-a3ed-41a6-9961-1386940c3ef7,08bef212-3a1a-41fb-b4f8-de88b50a914b,Store Purchase SIRIUS XM RADIO INC.,24.74,Debit,Siriusxm payment.,Entertainment / Music
MQGN7N3PKYRA,20d7d439-8c83-49d7-a030-cc808ddb9715,20403410-28e1-4b1c-997c-1b0269f63019,SPOTIFY 06/03 PURCHASE 877-778-1161 NY,10.69,Debit,Monthly automatic premium Spotify payment.,Entertainment / Music
J6TM2D4MANTG,295f9784-d2ea-44c3-8c85-90bffca72ce8,ccf3d9ce-55e8-4878-9ae4-f00198ab0421,Spotify,17.31,Debit,This is a music subscription.,Entertainment / Music
4TGHEHM2RVX7,9dffb805-cb58-4a85-af90-52604b4e395f,1c3737e8-a4eb-4d75-a278-621989266242,Signature POS Debit 06/11 6337 KY LEXINGTON HALF PRICE BOOK,13.24,Debit,I bought a CD.,Entertainment / Music
PC663CTNCDXX,a6e9cefd-a6fd-4f79-8042-4483442d0b14,27f41cba-f0c6-4945-8cd9-1a1906804b47,8382 Recurring Debit Card Spotify 877-7781161,10.69,Debit,Monthly Spotify subscription service.,Entertainment / Music
PC663CTNCDXX,44103998-1220-445a-aaef-2d505b2b562d,60b03648-5010-4bfc-867c-4f5c55d5bb0a,SPOTIFY MUSIC SUBS USD RECURRING,11.3,Debit,Recurring Spotify monthly subscription fee.,Entertainment / Music
PC663CTNCDXX,33f52fff-c22e-48ca-8460-817d62d3b432,992627a3-8ac7-495e-b105-654c05f184a2,NATIONAL LOTTERY I CD 304,5,Debit,Money I paid to the UK National Lottery website to buy a ticket.,Entertainment / Casinos and gambling
PC663CTNCDXX,b3ff942f-4fae-4ebe-a3ad-962d75715a2d,7199c5bc-92b8-4230-9e2e-971fa3bacb62,RAILWAY MUSEUM CD 3041 20MAR22,9,Debit,A payment made while at a museum for my children to go on a special ride.,Entertainment / Amusement Parks
G7YACCWXTNEG,0c7828e3-0e64-415b-abbe-6c56ae07d921,3feb133a-05aa-4066-a528-b80b069e8231,FRISCO ATHLETIC CENTER,26,Debit,This is entry for two people into a water park/public pool.,Entertainment / Amusement Parks
G7YACCWXTNEG,25f9eeb1-639b-4d44-826e-f313ffbfe4f0,50435f01-af13-4722-a7ef-c2e8bae78c39,CREEPY CRAWLIES CREEPY UNITED KINGDOM,28.5,Debit,A family visit to a children's place centre.,Entertainment / Amusement Parks
G7YACCWXTNEG,08c5f4e9-bd01-4bc8-bb38-fb7fcebacbc0,9330ef6c-b1df-4e53-9392-bf4c775d5dcd,TD AMERITRADE ACH IN sUUV7T6R6,10,Debit,Electronic transfer of $10 to TD Ameritrade.,"Bank Transfers / Transfers to checking, savings, retirement accounts and other investment accounts"
6XA9X4RD9RAY,1acfcd4c-1f0b-4117-ae3e-557fad0b4832,7a59b8b9-9947-45d1-8b0c-9257df6bacd7,ACH Debit Funds Tran Michael Destafa ID1481213018,300,Debit,I transferred funds to another checking account.,"Bank Transfers / Transfers to checking, savings, retirement accounts and other investment accounts"
WNP9QWD2XJYT,6b574976-5125-4bd1-8e69-652ac4233731,41a00fb6-ffe6-4ef3-ab93-7338236412a4,FCB FUNDS TRANSFER TO X3428,35,Debit,Transfer between checking accounts.,"Bank Transfers / Transfers to checking, savings, retirement accounts and other investment accounts"
PAEJPZXXTQ2M,e890c89a-34cf-4252-937e-4c5070933a00,eac48a82-ce5f-4950-b125-c3d9ba0a52c1,TRNSFR CR PENTAGON FEDERAL WEB,900,Credit,I made a bank transfer and this was the side of the transaction that received the funds (I own both accounts).,"Bank Transfers / Transfers to checking, savings, retirement accounts and other investment accounts"
PC663CTNCDXX,802f111e-e33b-4ee8-85b9-a16dd22ac527,df1b543f-ae7c-4e76-ba7e-e905318ca4a5,ACH Withdrawal STASH CAPITAL (S ACH,5,Debit,Automatic funds transfer to a Stash investment account.,"Bank Transfers / Transfers to checking, savings, retirement accounts and other investment accounts"
YYCA2DXN94NG,ead5f87c-d7b4-43a4-8548-5a586d7b836a,aa86a489-a6f9-451a-8635-45191f722d15,Deposit from 360 Checking xxxxxxx9999,100,Credit,Deposit from Capital One checking to Capital One savings.,"Bank Transfers / Transfers to checking, savings, retirement accounts and other investment accounts"
MFVVAY4H7Y4H,bc2aa08c-27b4-4445-8975-7ad3047a04c5,1bb09b6a-9d2e-4c8c-bf4a-45ae337254a4,TRANSFER DB TO ******79,100,Debit,Transfer money from savings to checking.,"Bank Transfers / Transfers to checking, savings, retirement accounts and other investment accounts"
G7YACCWXTNEG,b5ce8545-20a4-46f3-8cea-aa783fc45132,484d4424-09f9-4ecb-91f3-08a34fd70a7d,SHARE DEALINGS LEE CD 3041,500,Debit,Money transferred to a share dealing account in order to buy some shares.,"Bank Transfers / Transfers to checking, savings, retirement accounts and other investment accounts"
G7YACCWXTNEG,8b14eda2-3d9a-4f4b-9ae2-617a8af75521,5c472354-53ee-4891-b8c0-a9f468e44a77,Internet transfer from Online Savings account XXXXXX9497,"1,000.00",Credit,Transfer from savings to checking.,"Bank Transfers / Transfers to checking, savings, retirement accounts and other investment accounts"
G7YACCWXTNEG,bacb344e-055e-43f8-82d2-114aaf5a4771,981740a8-ed1a-4dd6-bab3-51de13c65cb2,WIRE TYPE: FX OUT,"1,101.20",Debit,I transferred money into another account.,"Bank Transfers / Transfers to checking, savings, retirement accounts and other investment accounts"
6XA9X4RD9RAY,ce291313-8675-44b7-86df-a7a8c7bf3402,bafd3629-3bb8-42a0-9ae3-7ba0e834d840,MTTSB 0018,"2,200.00",Debit,Money I transferred to my joint account with my wife.,"Bank Transfers / Transfers to checking, savings, retirement accounts and other investment accounts"
WNP9QWD2XJYT,818b42b7-4ff0-4553-a983-ebdf4d57574c,cb548a23-ff13-4885-9711-73a14ef50116,ONLINE TRANSFER FROM Money Market Jun15 02:28p 145 REFERENCE # 008291,160,Credit,From Savings to Checkings account.,"Bank Transfers / Transfers to checking, savings, retirement accounts and other investment accounts"
PAEJPZXXTQ2M,f320db73-5816-4231-aad3-4e814599ceb3,2e8c242b-f580-4d6c-bb29-1159ce95fa6d,CAPITAL ONE N.A. CAPITALONE *************89,200,Credit,Transfer from my savings account to my checking for expenses.,"Bank Transfers / Transfers to checking, savings, retirement accounts and other investment accounts"
PC663CTNCDXX,da07c39f-c076-4ffc-8194-bea8e533e8f3,0405d04e-850b-4414-898a-a17c58909fbf,FCB FUNDS TRANSFER FROM X3428,139.56,Credit,Transfer from checking account to savings account.,"Bank Transfers / Transfers to checking, savings, retirement accounts and other investment accounts"
